title,company,location,description,category
Director of Software Engineering,Capital One,"London, UK","White Collar Factory (95009), United Kingdom, London, London Director of Software Engineering About this role We are looking for a Director of Software Engineering to lead a team of 100 engineers. We’re looking for someone who is results-oriented, able to partner with business leaders and go toe-to-toe with the best engineers on technical rigour. You’ll be responsible for all the technologists within a series of our ‘outcome teams’: established to drive forward business outcomes. You’ll be an e…",IT Jobs
Software Engineer,Richmond Square Consulting Limited,"Cheltenham, Gloucestershire","Software Engineer (Rust) Cheltenham / Hybrid / Remote My client is looking for an experienced Software Engineer with strong Rust expertise to join a growing UK technology business delivering secure software and communications solutions into the national defence sector. This is an opportunity to work across live programmes, next-generation product development, and cutting-edge proof-of-concept work, using modern engineering to solve complex real-world challenges. It would suit someone who wants …",IT Jobs
Software Engineer,UK Prog Agency VONQ Direct CPC,"Bocking, Braintree","Nordson Test & Inspection , a global leader in world-class metrology equipment and inspection systems, is seeking a highly motivated and talented S oftware Engineer to join our AXM team in Colchester , UK . We are committed to creating a diverse and inclusive workplace, and we are looking for candidates who share that same commitment. Summary of the role As a member of our software team, you will have the opportunity to work in a dynamic and collaborative environment, where your ideas and contr…",Engineering Jobs
Software Engineer,UK Prog Agency VONQ Direct CPC,"Kirby Cross, Frinton-On-Sea","Nordson Test & Inspection , a global leader in world-class metrology equipment and inspection systems, is seeking a highly motivated and talented S oftware Engineer to join our AXM team in Colchester , UK . We are committed to creating a diverse and inclusive workplace, and we are looking for candidates who share that same commitment. Summary of the role As a member of our software team, you will have the opportunity to work in a dynamic and collaborative environment, where your ideas and contr…",Engineering Jobs
Software Engineer,UK Prog Agency VONQ Direct CPC,"Nine Ashes, Ingatestone","Nordson Test & Inspection , a global leader in world-class metrology equipment and inspection systems, is seeking a highly motivated and talented S oftware Engineer to join our AXM team in Colchester , UK . We are committed to creating a diverse and inclusive workplace, and we are looking for candidates who share that same commitment. Summary of the role As a member of our software team, you will have the opportunity to work in a dynamic and collaborative environment, where your ideas and contr…",Engineering Jobs
Software Engineer,UK Prog Agency VONQ Direct CPC,"Mardy, Abergavenny","Nordson Test & Inspection , a global leader in world-class metrology equipment and inspection systems, is seeking a highly motivated and talented S oftware Engineer to join our AXM team in Colchester , UK . We are committed to creating a diverse and inclusive workplace, and we are looking for candidates who share that same commitment. Summary of the role As a member of our software team, you will have the opportunity to work in a dynamic and collaborative environment, where your ideas and contr…",Engineering Jobs
Software Engineer,UK Prog Agency VONQ Direct CPC,"Highwoods, Colchester","Nordson Test & Inspection , a global leader in world-class metrology equipment and inspection systems, is seeking a highly motivated and talented S oftware Engineer to join our AXM team in Colchester , UK . We are committed to creating a diverse and inclusive workplace, and we are looking for candidates who share that same commitment. Summary of the role As a member of our software team, you will have the opportunity to work in a dynamic and collaborative environment, where your ideas and contr…",Engineering Jobs
Software Engineer,UK Prog Agency VONQ Direct CPC,"Rivenhall, Witham","Nordson Test & Inspection , a global leader in world-class metrology equipment and inspection systems, is seeking a highly motivated and talented S oftware Engineer to join our AXM team in Colchester , UK . We are committed to creating a diverse and inclusive workplace, and we are looking for candidates who share that same commitment. Summary of the role As a member of our software team, you will have the opportunity to work in a dynamic and collaborative environment, where your ideas and contr…",Engineering Jobs
Software Engineer,UK Prog Agency VONQ Direct CPC,"Sible Hedingham, Halstead","Nordson Test & Inspection , a global leader in world-class metrology equipment and inspection systems, is seeking a highly motivated and talented S oftware Engineer to join our AXM team in Colchester , UK . We are committed to creating a diverse and inclusive workplace, and we are looking for candidates who share that same commitment. Summary of the role As a member of our software team, you will have the opportunity to work in a dynamic and collaborative environment, where your ideas and contr…",Engineering Jobs
Software Engineer,ATA Recruitment,"Widnes, Cheshire","PLC Software Engineer – Industrial Automation (Material Handling & Controls) Location: North West UK (must be based in the region) Type: 6-Month Contract → Permanent (Full-time) Salary: £60,000 – £80,000 On-site: 5 days per week (38 hours) with global travel required About the Role We are seeking an experienced PLC Software Engineer to join a specialist engineering team delivering advanced automated material handling systems used in aviation security environments worldwide. This is a hands-on r…",Engineering Jobs
Software Engineer,Saab UK,"Fareham, Hampshire","Introduction Saab UK is part of Scandinavia's largest defence company, bringing together the best of Swedish and British innovation. Saab offers world-leading solutions and services in defence, aviation, space, and civil security to keep people and society safe. Our UK presence has been growing at pace, meaning we can offer a wide range of opportunities for personal fulfilment and career growth. We currently employ over 600 people across eight sites in the UK, and our specialisations include so…",IT Jobs
Software Engineer,EMBL-EBI,"Hinxton, Saffron Walden","The European Bioinformatics Institute (EMBL-EBI) is seeking a talented and motivated Software Engineer to join our SearchBot project. This new initiative will pilot natural language query (NLQ) capabilities across EBI Search, which indexes more than 6.6 billion records from EMBL-EBIs world-leading life science resources. The project will also explore frameworks for integrating specialised search services, such as sequence and chemical searches, with modern AI agents using emerging standards lik…",Scientific & QA Jobs
PLC Software Engineer,Samuel Frank,"Over Hulton, Bolton","PLC Software Engineer Rockwell PLCs FactoryTalk / Studio 5000 £50-62k  Hybrid Working Samuel Frank is recruiting for a PLC Software Engineer with Rockwell PLC experience to join a well-established, growing engineering business. The role is predominantly office-based with very limited site work and would suit a PLC Software Engineer who enjoys structured, collaborative development rather than constant travel. Key aspects of the PLC Software Engineer role include PLC Software Engineer will focus …",Engineering Jobs
Senior Software Engineer,Bright Purple Resourcing,"Edinburgh, Scotland",Senior Software Engineer Edinburgh An innovative and well-established med tech company are seeking a Senior Software Engineer to join its R&D team basedin central Edinburgh. This is a unique opportunity to play a key role in the development of next-generation patient monitoring and connectivity solutions that make a real difference in clinical environments. What is in it for you: Competitive salary Hybrid working - 2 days a week into the office 25 days annual leave - which increase in years of …,IT Jobs
Senior Software Engineer,Redline Group Ltd,"Ottershaw, Chertsey","Are you an experienced Software Engineer ready to take the lead on cutting-edge defence technology? Join a specialist engineering company based in Chertsey, delivering bespoke software and integrated systems for mission-critical military applications. My client designs, develops, and integrates advanced solutions that operate in some of the most demanding environments. This is an opportunity to work at the forefront of innovation, contributing to projects that truly matter. As a Senior Software…",IT Jobs
Principal Software Engineer,Redline Group Ltd,"Old Snydale, Pontefract","We are hiring a Principal Software Engineer (Embedded Systems) based in Normanton, West Yorkshire to lead the design and development of cutting-edge embedded software for next-generation products. This is a senior-level opportunity for an experienced Normanton based Principal Software Engineer with deep expertise in C programming, RTOS (Real-Time Operating Systems), and wireless communication protocols. Reporting to the Group Technical Engineering Director, you will play a key role in shaping s…",IT Jobs
Principal Software Engineer,Sirius Digital,"Port Solent, Portsmouth","Principal Software Engineer Salary: Negotiable plus benefits, pension (7% contribution), 25 days holiday & life insurance We are looking for principal software engineers with diverse experience. We are a small but rapidly growing consultancy, owned highly experienced and recognised practitioners in UK defence consultancy. We are looking for candidates with a mix of technical expertise and interpersonal skills, able to work independently and in small teams. The Role: As a Principal Software Engi…",IT Jobs
Senior Software Engineer,Fuel Recruitment,"Farnborough, Hampshire","Senior Software Engineer - Hybrid - Up to £90,000 Overview Fuel Recruitment is working with a well-established technology organisation seeking a Senior Software Engineer to join their expanding team. This role offers the chance to work across modern cloud platforms, Front End frameworks, and Back End languages while contributing to high-quality software solutions. You'll be joining an experienced engineering team delivering scalable, secure, and innovative applications. This is an excellent opp…",IT Jobs
Lead Software Engineer,Platform Recruitment Limited,"Oxford, Oxfordshire","Job Title: Lead Software Engineer Location: Oxfordshire: Hybrid Salary: up to £65,000 This is a rare opportunity for a senior software engineer to join a truly ground-breaking, high-precision manufacturing company. Youll be working at the intersection of software and hardware, helping to build cutting-edge technologies that are supplied worldwide. If you enjoy working on advanced industrial machines and being surrounded by some of the best engineers in the UK, this role could be a perfect fit. …",IT Jobs
Principal Software Engineer,Bright Purple Resourcing,"Edinburgh, Scotland",Principal Software Engineer Edinburgh An innovative and well-established med tech company are seeking a proven technical leader to join its R&D team basedin central Edinburgh as a Principal Software Engineer. This is a unique opportunity to play a key role in the development of next-generation patient monitoring and connectivity solutions that make a real difference in clinical environments. What is in it for you: Competitive salary Flexible working 25 days annual leave - which increase in year…,IT Jobs
Senior Software Engineer,Sirius Digital,"Port Solent, Portsmouth","Senior Software Engineer Salary: Negotiable plus benefits, pension (7% contribution), 25 days holiday & life insurance We are looking for senior software engineers with a range of levels of experience including designing and delivering software applications. We are a small but rapidly growing consultancy, owned by four highly experienced and recognised practitioners in UK defence consultancy. We are looking for candidates with a mix of technical expertise and interpersonal skills, able to work …",IT Jobs
Software Engineer C++,Sirius Digital,"Port Solent, Portsmouth","Software Engineer Salary: Competitive, negotiable based on experience, plus benefits including a 7% pension contribution, 25 days holiday, and life insurance Location: Portsmouth, hybrid working Sirius Digital is a trusted provider of expertise in Software Engineering, Data Science, and AI, supporting clients in the defence, nuclear, space, and energy sectors. We specialise in software modelling and simulation, robotics and autonomous systems, as well as data science and engineering, delivering…",IT Jobs
Lead Software Engineer,Saab UK,"Fareham, Hampshire","Introduction Saab UK is part of Scandinavia's largest defence company, bringing together the best of Swedish and British innovation. Saab offers world-leading solutions and services in defence, aviation, space, and civil security to keep people and society safe. Our UK presence has been growing at pace, meaning we can offer a wide range of opportunities for personal fulfilment and career growth. We currently employ over 600 people across eight sites in the UK, and our specialisations include so…",IT Jobs
Lead Software Engineer,Optum,"Carmunnock, Glasgow","Job Description Optum is a global organization that delivers care, aided by technology to help millions of people live healthier lives. The work you do with our team will directly improve health outcomes by connecting people with the care, pharmacy benefits, data and resources they need to feel their best. Here, you will find a culture guided by diversity and inclusion, talented peers, comprehensive benefits and career development opportunities. Come make an impact on the communities we serve a…",IT Jobs
Electronic Software Engineer,KO2 Embedded Recruitment Solutions Ltd,"Spital Tongues, Newcastle Upon Tyne","Electronics / Embedded Design Engineer Newcastle £40,000 - £45,000 doe KO2's client is expanding and is now looking to recruit an Electronics / Embedded Design Engineer to help establish a new R&D and design function within the business. This is a unique opportunity to join at an early stage of a new consultancy-focused team, where you will play a key role in shaping the direction of electronics design and development activities. The role will involve a combination of hardware and software deve…",Engineering Jobs
Software Engineer,Randstad Technologies,"Manchester, Greater Manchester","Job Title: Software Engineer Manchester, UK Hybrid (once/week) 6month contract with Potential Extension Day rate - 56GBP/Hour Inside IR35 Software Engineer We are looking for a mid-level Software Engineer who builds with a ""Full-Ownership"" mindset. In this role, you aren't just writing code; you're managing the entire lifecycle of global-scale services. What You'll Do Build & Refactor: Write reusable code using standard design patterns. We value test automation as much as production code. Own t…",IT Jobs
Software Engineer,VRS Recruitment,"Manchester, Greater Manchester","Our client, a leading OEM of specialist scientific instruments, is looking for a friendly and adaptable Software Engineer to join a team tasked with designing the next generation of scientific analysis and instrument control software. Programming mainly in C#, you will be designing and building desktop applications against existing technology platforms and designing and implementing extensions to underlying frameworks for scientific instrument control, data acquisition and data processing. The …",IT Jobs
Software Engineer,Richmond Square Consulting Limited,"Cheltenham, Gloucestershire","Software Engineer / Polyglot Engineer Cheltenham / Hybrid My client is looking for a strong Software Engineer / Polyglot Engineer / Application Developer / Software Developer to join a growing UK technology business delivering secure software, mobile, and cloud-based solutions into the national defence sector. This is an opportunity to work across live programmes, next-generation product development, and cutting-edge proof-of-concept work in an environment that values strong engineering fundame…",IT Jobs
Software Engineer,Forward Role,"Cheltenham, Gloucestershire","Due to sustained demand from our National Security and Government clients, we are actively seeking multiple cleared Software Engineers for high-profile programmes (please note you must be willing to go to a high level of security clearance due to the nature of the work). Software Engineering - eDV cleared Package - £50,000- £80,000 Benefits - Clearance Bonus plus excellent benefits and relocation assistance Location - Manchester, Cheltenham or London. Join a trusted leader in National Security …",IT Jobs
Software Engineer,Frontier Resourcing Ltd,"South East London, London","Software Engineer – DV Cleared Locations: Manchester, Gloucester or London We're supporting a leading defence organisation delivering advanced technology solutions into the UK's defence and national security sector. Due to continued growth, they are looking for Software Engineers at multiple levels to join their high-performing engineering teams. This is an opportunity to work on mission critical systems that make a real world impact, within a highly secure environment. The Role As a Full Stack…",IT Jobs
Software Engineer,Orion Electrotech Sales,"Normanton, West Yorkshire","Software Engineer Burbage area We are working with an innovative engineering organisation developing advanced Aerospace technologies. They are now looking to hire an experienced Software Engineer to support the design and delivery of mission-critical software and firmware solutions. This role sits within a multidisciplinary engineering team and covers the full software lifecycle from design and development through testing, integration and deployment. Youll also contribute to system-level integr…",IT Jobs
Software Engineer,Fruition Group,"South East London, London","Software Engineer - Platform / Core Infrastructure London 4 days a week on site Up to £110k We're partnering with a rapidly scaling fintech that has transformed its market in just a few years. Their payments platform processes billions in transactions annually , supporting a growing customer base across multiple countries. As they continue to scale, they're investing heavily in the internal platform and infrastructure that powers their engineering teams. The Role This is an opportunity to join …",IT Jobs
Software Engineer,Blue Arrow - Swansea,"Dafen, Llanelli","Blue Arrow is urgently recruiting for a Software Engineer to join our clients growing Automotive Manufacturing team based in the Llanelli area. Contract : Permanent Salary : Up to £40,000p.a Hours of work : 37 hours per week: Mon-Thurs 8:30-17:00 & Fridays 9:00-15:00 Travel expected: Cannock in West Midlands and Germany (infrequently) Job Summary: Our client is seeking an experienced automotive Software Engineers to join their existing team. The post involves designing and developing software i…",IT Jobs
Software Engineer,OAL Group,"Orton Southgate, Peterborough","Software Engineer Location : Peterborough, PE2 6YN Salary : Up to £50k per annum (Subject to Experience) Contract: Full-Time, Permanent The software you build this month might prevent a product recall. Next month it might run a robotic cell. OAL's software engineers work across compliance, vision, robotics and traceability systems for UK food manufacturers. One project might be a label verification system for a major retailer. The next might be software for a robotic palletising cell, a vision …",IT Jobs
Software Engineer,Your Prime Recruitment Ltd,"Manchester, Greater Manchester","Founding Engineer Manchester (Hybrid) AI Product / Mobile / SaaS The Opportunity Were working with an early-stage, mission-led software business looking to hire a Founding Engineer to play a key role in the next evolution of their product. The business already has a live platform and strong market relevance the next phase is about rebuilding and improving the product for the AI era , with a particular focus on user experience, intelligent workflows, and mobile-first product thinking . This is a…",IT Jobs
Software Engineering Manager - Services,Capital One,"London, UK","White Collar Factory (95009), United Kingdom, London, London Software Engineering Manager - Services About this role Capital One is looking for a Software Engineering Manager to join us in our London office. You will have previous experience of leading a Software Engineering team and be passionate about people and technical leadership. What you’ll do Be a differential people leader. Literally. We expect you to coach and nurture your engineers and make a material positive difference to their car…",Engineering Jobs
Software Engineer,Optamor,"Gloucester, Gloucestershire","Software Engineer Gloucester, Gloucestershire £43000 - £98000 p/a with BUPA, bonus and full benefits 4 Day Work Week options Lockheed Martin Rotary and Mission Systems (RMS) provides systems engineering, software development, training solutions and complex program management for global security, civil and commercial markets. We have exciting opportunities at varying seniority levels, arising at our site in Gloucester for Software Engineers, primarily a variety of Defence, Cyber and Intelligence…",IT Jobs
Director of Software Engineering,Capital One UK,"London, UK","White Collar Factory (95009), United Kingdom, London, London Director of Software Engineering About this role We are looking for a Director of Software Engineering to lead a team of 100 engineers. We’re looking for someone who is results-oriented, able to partner with business leaders and go toe-to-toe with the best engineers on technical rigour. You’ll be responsible for all the technologists within a series of our ‘outcome teams’: established to drive forward business outcomes. You’ll be an e…",Engineering Jobs
Staff Software Engineer - Back End,Capital One,"London, UK","White Collar Factory (95009), United Kingdom, London, London Staff Software Engineer - Back End About this role Do you love shaping the technical landscape and driving innovation across the organisation? Are you passionate about solving complex business problems and supporting multiple teams toward a shared technical vision? At Capital One, you'll be part of a community of technical leaders who drive engineering excellence, foster innovation, and deliver impactful solutions that meet real custo…",IT Jobs
Embedded Ada Software Engineer,Certain Advantage,"Filton, Bristol","World Class Defence Organisation based in Bristol is currently looking to recruit 2x Embedded ADA Software Engineer subcontractors on an initial 12 month contract. The role will likely be required to be onsite, but it can be worked on a 4-day week basis. Essential - ADA, Background in safety critical software. Desirable - Linux, Doors, Dimensions, UML, Mascot etc. Contract Duration: 12 Months initially and then ongoing. Hourly Rate: £68.00ph (Umbrella). Overtime rate: Hours worked over 37 hours…",IT Jobs
Head of Software Engineering - Peterborough,Circle Group,"Peterborough, Eastern England","Head of Software Engineering - Peterborough Head of Software Engineering with and excellent background in engineering (ideally .NET), DevOps, (including DevSecOps ideally) and cloud is required by a leading company in Peterborough. It is technical leadership role focused on Software Engineering, DevOps and end-to-end technology estate. With a team of 10, you will be turning architectural concepts into implementation reality, so very much a delivery role, being part of the senior leadership team…",IT Jobs
Principal Software Engineer - Verification,IO Associates,"Bristol, South West England","Shape how safety-critical software is verified at the highest level. We're partnering with a growing, highly respected engineering SME specialising in safety-critical embedded systems . They are looking for a Principal Software Engineer to play a key role in developing and assuring high-integrity embedded software, including a safety-certified real-time operating system. This is a hands-on software engineering role within the verification team, combining technical leadership with deep involveme…",IT Jobs
Firmware/Software Engineer,Unipart,"Stockport, Greater Manchester","Salary: Circa £40,000 Hours: 37.5 Contract: Full time Location: Stockport At Park Signalling we utilise our specialist engineering skills and knowledge to deliver products and services including consultancy and projects. We deliver design and development, application engineering, prototype manufacture, repair and consultancy at any stage in the life-cycle of a system or product. We design, manufacture and supply a range of products for the needs of the world-wide railway signalling, telecommuni…",Engineering Jobs
Software Engineer - SC,CBSbutler Holdings Limited,"Romsey, Hampshire","Software Engineer Hybrid - 2 days per week onsite in either Romsey / Gloucester / Woking Up to £60,000 per annum  benefits SC clearance We are looking for a talented Software Engineer to join a cutting-edge team developing software for RF communication and sensor-based products. You'll play a key role in the design, implementation, and testing of product software, working closely within an agile team alongside the Product Owner and System Design Authority. This is a flexible role where you can …",IT Jobs
