title,company,location,description,category
Software Engineering Associate Advisor,Evernorth,"Hyderabad, Telangana","About Evernorth: Evernorth Health Services, a division of The Cigna Group (NYSE: CI), creates pharmacy, care, and benefits solutions to improve health and increase vitality. We relentlessly innovate to make the prediction, prevention, and treatment of illness and disease more accessible to millions of people. Software Engineering Advisor Position Overview: The job profile for this position is Software Engineering Advisor, which is a Band 4 Contributor Career Track Role. Excited to grow your car…",IT Jobs
"Software Engineer, Salesforce_IHC300",Marriott Tech Accelerator,"Hyderabad, Telangana","About Marriott: Marriott Tech Accelerator is part of Marriott International, a global leader in hospitality. Marriott International, Inc. is a leading American multinational company that operates a vast array of lodging brands, including hotels and residential properties. It consists of over 30 well-known brands and nearly 8,900 properties situated in 141 countries and territories. Role Title: Software Engineer Salesforce Position Summary: At Marriott International, we are seeking a highly enga…",IT Jobs
Software Engineer (AI/ML),Connext,"Jaipur, Rajasthan","AI / ML Engineer, Software Engineering About the Role Experienced and forward-thinking AI/ML Engineer with a strong engineering background and experience leading technical teams. The ideal candidate thrives at the intersection of AI/ML systems engineering, platform development, and intelligent agent design. This individual will play a key role in building and scaling AI capabilities across our platform, with a focus on production-grade systems rather than data science Responsibilities Design, b…",IT Jobs
Senior Software Engineer – Python,Scry AI,"Bangalore, Karnataka","Employment Type : Full Time Location : Remote Experience : 3 Years in Python Development, Backend Engineering, or Software Development Roles Company Description Scry AI is a research-led enterprise AI company that builds intelligent platforms for BFSI, insurance, logistics, and industrial enterprises to drive efficiency, insight, and compliance. Our product suite includes Auriga for conversational AI, Collatio for document intelligence, and Concentio for cognitive IoT and operational intelligen…",IT Jobs
Software Engineer Level 3,Costco,"Hyderabad, Telangana","Job Description We are excited to announce an opening for Stibo Step Software Engineer Senior at Costco. Please find the details of the role and its responsibilities. Skills Required: MDM and Stibo STEP, JavaScript, Pub/Sub technologies. Experience Range: 8 Years Job Description: Position Summary We're looking for a passionate expert Stibo STEP engineer eager to solve complex problems at a global scale. At Costco, we're building the next generation of retail technology, and we need talented ind…",IT Jobs
Senior Software Engineer II,Marriott Tech Accelerator,"Hyderabad, Telangana","About Us: Marriott International Inc. , headquartered in Bethesda, Maryland, USA, was founded in May 1927 by J. Willard Marriott and Alice S. Marriott with a modest nine-seat A&W root beer stand. Guided by the family's leadership and core principles, Marriott International today has grown into a global hospitality giant, operating approximately 9,000 properties and over 30 leading brands in more than 140 countries and territories. From such humble beginnings to becoming the worlds largest hotel…",IT Jobs
Software Engineering Senior Analyst,Evernorth,"Hyderabad, Telangana","About Evernorth: Evernorth Health Services, a division of The Cigna Group (NYSE: CI), creates pharmacy, care, and benefits solutions to improve health and increase vitality. We relentlessly innovate to make the prediction, prevention, and treatment of illness and disease more accessible to millions of people. Software Engineering Senior Analyst Position Overview: The job profile for this position is Software Engineering Lead Analyst, which is a Band 3 Contributor Career Track Role. Excited to g…",IT Jobs
Embedded System Software Engineer,Zen Technologies Limited,"Hyderabad, Telangana","We are seeking an Embedded Software Engineer with 4-6 years of experience to support the design, integration, testing, and deployment of advanced embedded systems in a high-technology environment. This role involves working on embedded control software, onboard electronics, sensor integration, power systems, and communication interfaces for complex engineering platforms.  Key Responsibilities Develop and maintain embedded software for control, monitoring, and system interfaces Design, integrate…",Engineering Jobs
Software Engineering Manager IND,FM India,"Bangalore, Karnataka","Role Title: Software Engineering Manager Position Summary: This role is a player / coach manager and a contributing member of their technology teams. The role oversees technology delivery of their teams, which may be comprised of full-time technologists, contingent workers, and / or vendor partners. This role guides technology direction and leads technical initiatives for their product teams. It is the quality gatekeeper of their teams and ensures FM development, security, and test standards ar…",IT Jobs
Lead Software Engineer- IHC431,Marriott Tech Accelerator,"Hyderabad, Telangana","About Marriott: Marriott Tech Accelerator is part of Marriott International, a global leader in hospitality. Marriott International, Inc. is a leading American multinational company that operates a vast array of lodging brands, including hotels and residential properties. It consists of over 30 well-known brands and nearly 8,900 properties situated in 141 countries and territories. Title: Lead Software Engineer Position Summary: Marriott International is the worlds largest hotel company, with m…",IT Jobs
Software Engineering Lead Analyst,Evernorth,"Hyderabad, Telangana","About Evernorth: Evernorth Health Services, a division of The Cigna Group (NYSE: CI), creates pharmacy, care, and benefits solutions to improve health and increase vitality. We relentlessly innovate to make the prediction, prevention, and treatment of illness and disease more accessible to millions of people. Title: Software Engineering Associate Advisor The AI CoE team is seeking Fullstack Software Engineers to work on the AI ecosystem. The Fullstack Engineer will be responsible for designing,…",IT Jobs
Lead Software Engineer-IHC432,Marriott Tech Accelerator,"Hyderabad, Telangana","About Marriott: Marriott Tech Accelerator is part of Marriott International, a global leader in hospitality. Marriott International, Inc. is a leading American multinational company that operates a vast array of lodging brands, including hotels and residential properties. It consists of over 30 well-known brands and nearly 8,900 properties situated in 141 countries and territories. Title: Lead Software Engineer Position Summary: Marriott International is the worlds largest hotel company, with m…",IT Jobs
Software Engineer Finite Scheduling,Bristol Myers Squibb,"Hyderabad, Telangana","Job Description: Software Engineer, Finite Scheduling Working With Us Challenging. Meaningful. Life-changing. Those arent words that are usually associated with a job. But working at Bristol Myers Squibb is anything but usual. Here, uniquely interesting work happens every day, in every department. From optimizing a production line to the latest breakthroughs in cell therapy, this is work that transforms the lives of patients, and the careers of those who do it. Youll get the chance to grow and …",IT Jobs
Software Engineering Lead Analyst,Evernorth,"Hyderabad, Telangana","About Evernorth: Evernorth Health Services, a division of The Cigna Group (NYSE: CI), creates pharmacy, care, and benefits solutions to improve health and increase vitality. We relentlessly innovate to make the prediction, prevention, and treatment of illness and disease more accessible to millions of people. Position Summary: This role requires you to be fluent in some of the critical technologies with proficiency in others and have a hunger to learn on the job and add Value to the business. C…",IT Jobs
Software Engineering Senior Analyst,Evernorth,"Hyderabad, Telangana","About Evernorth: Evernorth Health Services, a division of The Cigna Group (NYSE: CI), creates pharmacy, care, and benefits solutions to improve health and increase vitality. We relentlessly innovate to make the prediction, prevention, and treatment of illness and disease more accessible to millions of people. Role Title: Software Engineering Senior Analyst Position Summary: Cigna, a leading Health Services company, is looking for Data Engineers in our Engineering Enablement Office (EEO) organiz…",IT Jobs
Staff Software Engineer - TM,Alkami,"Gurgaon, Haryana","Purpose of the Job: The Senior Software Engineer will drive efforts and contribute to building computer software systems, participating in the design process from beginning to end. Demonstrates deep technical domain knowledge of the company, including apps, services, systems, or frameworks. A key strategic player involved in maintenance of product features, including on call escalations, triaging and resolution. The above statements describe the general nature and level of work being performed …",IT Jobs
Senior Software Engineer - TM,Alkami,"Gurgaon, Haryana","Purpose of the Job: The Senior Software Engineer will drive efforts and contribute to building computer software systems, participating in the design process from beginning to end. Demonstrates deep technical domain knowledge of the company, including apps, services, systems, or frameworks. A key strategic player involved in maintenance of product features, including on call escalations, triaging and resolution. The above statements describe the general nature and level of work being performed …",IT Jobs
Senior Software Engineer IND,FM India,"Bangalore, Karnataka","About us: We are a highly successful 190-year-old, Fortune 500 commercial property insurance company of 6,000 employees with a unique focus on science and risk engineering. Businesses worldwide trust our expertise to protect their assets, relying on our comprehensive risk assessments and robust, engineering-based insurance solutions to safeguard against fire, natural disasters, and other perils. Serving over a quarter of the Fortune 500 and major corporations globally, we deliver data-driven st…",IT Jobs
Principal Software Engineer - TM,Alkami,"Gurgaon, Haryana","General Purpose of the Job: The Principal Engineer will build computer software systems, participating in the design process from beginning to end. Leads architectural design patterns and decisions to achieve our strategic product goals at the enterprise level. Demonstrates deep technical domain knowledge and ownership of multiple enterprise product features end-to-end. A key strategic player involved in maintenance of enterprise product features, including on call escalations, triaging and res…",IT Jobs
Senior Software Engineering Manager,Under Armour India,"Bangalore, Karnataka","PURPOSE OF ROLE: The UnderArmourDigital Commerce teamresponsible for UA.com, the UnderArmourApp, and related services and systemsis seeking a Senior Manager,Web Engineeringfor our UnderArmourIndia (UAI) office. This role will partner closely with the Global Engineering leadership team to leadafullstackwebfocused engineeringteamat UAI.ThisUAI web team willhave a heavy focus onfrontendtechnologies responsible for building, supporting, andmaintainingweb experiencesforour digital customer touchpoin…",IT Jobs
Senior Software Engineer - Backend,GoodScore,"Bangalore, Karnataka","Goodscore is on a mission to make financial literacy and credit access simple, actionable, and inclusive for over 150 million Indians who are credit-underserved. From starting personalized credit consulting in 2023 to now empowering over 5 million users to take control of their credit health, we are one of India’s fastest-growing credit score & credit management apps. We are backed by leading VC funds in India, consistently ranked among the top 10 finance apps in the country, and are currently …",IT Jobs
"Senior Software Engineer, Frontend",Commotion,"Mumbai, Maharashtra","We’re looking for a self-starter who thrives on ownership and loves building beautiful, performant, and scalable web experiences. You’ll lead the frontend efforts for Commotion’s product suite — helping shape the product, architecture, and engineering culture as we scale. What you’ll do Lead the design and development of our frontend systems using React, Redux, and TypeScript Collaborate closely with product, design, and backend teams to ship high-quality features fast Own frontend architecture…",IT Jobs
Senior Software Engineering Manager,Under Armour India,"Bangalore, Karnataka","PURPOSE OF ROLE: The Senior Manager, SAP Engineering leads the strategy, delivery, and performance of SAP technical solutions, overseeing development, integration, and platform engineering teams. The role ensures scalable, high quality SAP systems, drives modernization and automation initiatives, and partners with business and technology leaders to enable enterprise-wide digital capabilities. Reporting Structure - You will report directly to amanager employed by Under Armour Global Services Pvt…",IT Jobs
Senior Software Engineering Manager,Under Armour India,"Bangalore, Karnataka","PURPOSE OF ROLE: The Under Armour Digital Commerce teamresponsible for UA.com, the Under Armour App, and related services and systemsis seeking a Senior Manager, App Engineering for our Under Armour India (UAI) office. This role will partner closely with the Global Engineering leadership team to lead mobile app engineering at UAIacross iOS and Android, driving adoption and continued evolution of Kotlin Multiplatform (KMP) to deliver scalable, consistent, and high-quality app experiences. Report…",Engineering Jobs
Software Engineering Associate advisor,Evernorth,"Hyderabad, Telangana","About Evernorth: Evernorth Health Services, a division of The Cigna Group (NYSE: CI), creates pharmacy, care, and benefits solutions to improve health and increase vitality. We relentlessly innovate to make the prediction, prevention, and treatment of illness and disease more accessible to millions of people. Responsibilities: Candidates will need to have experience with medium-to-large-scale web development. Ability to develop within full technology stack Be part of a fast moving team, working…",IT Jobs
Software Engineering Senior Advisor,Evernorth,"Hyderabad, Telangana","About Evernorth: Evernorth Health Services, a division of The Cigna Group (NYSE: CI), creates pharmacy, care, and benefits solutions to improve health and increase vitality. We relentlessly innovate to make the prediction, prevention, and treatment of illness and disease more accessible to millions of people. Responsibilities: Candidates will need to have experience with medium-to-large-scale web development. Ability to develop within full technology stack Be part of a fast moving team, working…",IT Jobs
Senior Staff Software Engineer,ANSR Summit Consulting,"Gurgaon, Haryana","Role and Responsibilities: Deliver highly scalable, available, and fault-tolerant production applications. Help prevent and investigate production issues. Build architecture design, influence product roadmap, and take ownership and responsibility over new projects. Lead code/design reviews to ensure smooth daily operations and accurate planning Participate in the entire application lifecycle, focusing on coding and debugging Write clean code to develop functional applications Identify bottlenec…",IT Jobs
Sr. Software Engineer - DevOps,HME,"Bangalore, Karnataka","About HME: For over 50 years, HME has created industry-leading products and services, their earliest being the first wireless microphone for the professional audio market in 1974. Since then, they have evolved greatly and pioneered into a variety of niche markets, setting new benchmarks with their work. HME believes that theres more to a person than whats written on their resume. HME sees their employees for who they are and value every idea and opinion its what fuels their innovative thinking …",IT Jobs
Senior Software Engineer (Embedded),HME,"Bangalore, Karnataka","About HME: For over 50 years, HME has created industry-leading products and services, their earliest being the first wireless microphone for the professional audio market in 1974. Since then, they have evolved greatly and pioneered into a variety of niche markets, setting new benchmarks with their work. HME believes that theres more to a person than whats written on their resume. HME sees their employees for who they are and value every idea and opinion its what fuels their innovative thinking …",IT Jobs
Senior Software Engineering Manager,Under Armour India,"Bangalore, Karnataka","PURPOSE OF ROLE: At Under Armour,werebuilding software to power the future of connected fitness.Wereserious about individual growth and athlete achievement, andwedlike you to join us in building real products that will help millions of people improve their lives through better health& fitness. We'rehiring a Senior Manager in our Infrastructure Engineering organization, which powers an ecosystem of over 200M athletes, fitness enthusiasts, and people pursuing a healthy lifestyle. In this role, yo…",IT Jobs
Staff Software Engineer (Embedded),HME,"Bangalore, Karnataka","About HME: For over 50 years, HME has created industry-leading products and services, their earliest being the first wireless microphone for the professional audio market in 1974. Since then, they have evolved greatly and pioneered into a variety of niche markets, setting new benchmarks with their work. HME believes that theres more to a person than whats written on their resume. HME sees their employees for who they are and values every idea and opinion its what fuels their innovative thinking…",IT Jobs
Software Engineering Senior Analyst,Evernorth,"Hyderabad, Telangana","About Evernorth Evernorth Health Services, a division of The Cigna Group (NYSE: CI), creates pharmacy, care, and benefits solutions to improve health and increase vitality. We relentlessly innovate to make the prediction, prevention, and treatment of illness and disease more accessible to millions of people. Application Development Lead Analyst Position Overview: This positions primary responsibility will be to translate software requirements into functions using Mainframe, ETL frameworks, Data…",IT Jobs
Sr. Power Systems Software Engineer/ Staff Power Systems Software Engineer,GridAstra,India,"GridAstra is pioneering a new category of innovative Grid Software solutions. Our software platform accelerates the interconnection and sustained operation of new large loads (i.e. AI Data Centers), generation, and storage by de-congesting the power grid in an intelligent manner — reliably and cost-effectively. We are looking for a passionate and experienced individual who is ready to partner with us in our mission to build such innovative Grid Software platform ground up. If you are one of the…",Engineering Jobs
Sr Software Engineer - Open Search,HME,"Bangalore, Karnataka","HME is looking for a Senior Software Engineer to own and operate our OpenSearch-based Observability Platform . This role is responsible for running a highly available, secure, and scalable OpenSearch platform on Azure Kubernetes Service (AKS), acting as the DevOps and SRE owner and enabling application teams to onboard telemetry using Open Telemetry. What you will do in the position: Own DevOps and SRE responsibilities for the OpenSearch observability platform. Design, deploy, and operate OpenS…",IT Jobs
Senior Software Engineer I_IHC040,Marriott Tech Accelerator,"Hyderabad, Telangana","About Us: Marriott International Inc. , headquartered in Bethesda, Maryland, USA, was founded in May 1927 by J. Willard Marriott and Alice S. Marriott with a modest nine-seat A&W root beer stand. Guided by the family's leadership and core principles, Marriott International today has grown into a global hospitality giant, operating approximately 9,000 properties and over 30 leading brands in more than 140 countries and territories. From such humble beginnings to becoming the worlds largest hotel…",IT Jobs
"Software Engineer II, Aera DI",Bristol Myers Squibb,"Hyderabad, Telangana","Position Summary : The Software Engineer II, Aera DI role is accountable for developing data solutions and operations support of the Enterprise data lake. The role will be accountable for developing the pipelines for the data enablement projects, production/application support and enhancements, and support data operations activities. Additional responsibilities include data analysis, data operations process and tools, data cataloguing, and developing data SME skills in Global Product Developmen…",IT Jobs
"Software Engineer III, Developer Platforms",Wayfair,"Bangalore, Karnataka","Candidates for this position are preferred to be based in Bangalore, India Who We Are: Wayfair leads e-commerce for all things home, driven by modern tech. We seek sharp thinkers who design scalable systems while keeping a startup mindset. Our culture values fast, data-driven innovation. The Observability team needs experienced engineers skilled in cloud-native design, legacy maintenance, and SRE best practices—plus ideas for improvement! We collaborate across Tech to ensure platforms and servi…",IT Jobs
Agentic AI Software Engineer – Test,Stello Inc.,India,"Agentic AI Software Engineer – Test Remote · Full-Time Compensation: ₹10 LPA About the Role We are building the future of HR Tech. As an Agentic AI Software Engineer – Test, you will own quality across the entire product stack, from AI-driven automated pipelines to hands-on manual validation. Your goal is to ensure everything we ship works exactly as customers expect. This role sits at the intersection of AI, quality engineering, and product thinking. You will work closely with customers, under…",Engineering Jobs
Software Engineer 4 - Adobe-MarTech,Costco,"Hyderabad, Telangana","Software Engineer 4 - Adobe (MarTech) About Costco Wholesale: Costco Wholesale is a multi-billion-dollar global retailer with warehouse club operations in eleven countries. They provide a wide selection of quality merchandise, plus the convenience of specialty departments and exclusive member services, all designed to make shopping a pleasurable experience for our members. About Costco Wholesale India: At Costco Wholesale India, we foster a collaborative space, working to support Costco Wholesa…",IT Jobs
Software Engineer 4 (Martech/AdTech),Costco,"Hyderabad, Telangana","Position Title: Software Engineer 4 (Martech/AdTech) Job Description: Roles & Responsibilities: Design and develop scalable Martech/AdTech solutions across web, mobile, and backend systems Build and integrate APIs to support campaign delivery, personalization, and tracking Collaborate with product, data, and engineering teams to deliver reliable and performant ad & marketing experiences Implement targeting and measurement capabilities using first- and third-party data Contribute to the architec…",IT Jobs
Senior Software Engineer II-IHC434,Marriott Tech Accelerator,"Hyderabad, Telangana","About Marriott: Marriott Tech Accelerator is part of Marriott International, a global leader in hospitality. Marriott International, Inc. is a leading American multinational company that operates a vast array of lodging brands, including hotels and residential properties. It consists of over 30 well-known brands and nearly 8,900 properties situated in 141 countries and territories. Title: Senior Software Engineer Position ID: IHC434 Position Summary: Marriott International is the worlds largest…",IT Jobs
Senior Software Engineer II- IHC434,Marriott Tech Accelerator,"Hyderabad, Telangana","About Marriott: Marriott Tech Accelerator is part of Marriott International, a global leader in hospitality. Marriott International, Inc. is a leading American multinational company that operates a vast array of lodging brands, including hotels and residential properties. It consists of over 30 well-known brands and nearly 8,900 properties situated in 141 countries and territories. Title: Senior Software Engineer II Position Summary: Marriott International is the worlds largest hotel company, w…",IT Jobs
Lead Software Engineer (UI - React),InRhythm,India,"We’re Looking For a Lead Software (UI - React) Engineer! Our Team is looking for someone who has a passion for building rich web applications. This individual will own the full software development lifecycle to assess, and deliver critical web application that will directly impact hundreds of thousands to millions of users. This individual will also help grow and coach engineers to realize their full potential as much as be mentored and coached themselves for upward career acceleration. We work…",IT Jobs
Senior Software Engineer - AI/ML,Bristol Myers Squibb,"Hyderabad, Telangana","Position Summary The GPS Data & Analytics Sr. Software Engineer (AI/ML) role is accountable for developing AI/ML & Gen AI Solutions, you will play a pivotal role in designing, developing, and deploying advanced AI/ML Models & Gen AI solutions in Global Product Development and Supply Data and Analytics Enablement organization. Position Responsibilities* Key Responsibilities: Design, develop, and implement machine learning models and AI algorithms to solve complex business problems. Implement Ret…",IT Jobs
