title,company,location,description,category
Software Engineer,DevSecAI,"The City, Central London","Company Description DevSecAI is the creator of Arko, a cutting-edge IDE-integrated security engine for AI-powered development with our own AI models. With a focus on embedding security into the build process, Arko helps modern teams building Apps, APIs, Agents and AI models to ensure secure development practices. By analysing architectural elements, data flows, and vulnerabilities, ARKO provides real-time security insights directly within the IDE. This solves the limitations of traditional stat…",IT Jobs
Software Engineer,DevSecAI,"London, UK","Company Description DevSecAI is the creator of Arko, a cutting-edge IDE-integrated security engine for AI-powered development with our own AI models. With a focus on embedding security into the build process, Arko helps modern teams building Apps, APIs, Agents and AI models to ensure secure development practices. By analysing architectural elements, data flows, and vulnerabilities, ARKO provides real-time security insights directly within the IDE. This solves the limitations of traditional stat…",IT Jobs
Software Engineer,5V Video,"The City, Central London","Software Engineer Contract to Permanent Hybrid (London) Rates negotiable Most backend systems look fine on paper until they hit production. This role is about building services that actually work at scale, under real user demand. Why This Role Leading major media/streaming end client Real production impact from day one Solving practical backend challenges in a high-scale environment The Company / Product You’ll be working on a large-scale platform used by millions, helping build and support bac…",IT Jobs
Software Engineer,Metric Bio,"Oxford, Oxfordshire","Metric Bio are proud to continue supporting one of our longest-standing partners, a pioneering medical device company whose technology is directly saving lives. Their platform has already been used in over 7,000 life-critical transplant procedures worldwide. Backed by a global healthcare leader and spun out of a world-renowned UK university, this is a rare opportunity to build software that genuinely matters. They are looking for a Windows Software Engineer to join a close-knit engineering team…",Engineering Jobs
Software Engineer,Experis UK,"Eastern England, UK","Location: Cheltenham INTRODUCTION We are looking to hire a skilled Software Developer to join our dynamic and innovative team. As a Software Developer, you will be responsible for designing, implementing, and maintaining high-performance, scalable software solutions using Python and related technologies. You will collaborate closely with cross-functional teams to develop and deploy robust web applications, leveraging your expertise in Flask, MongoDB, HTML, CSS, Bootstrap, JavaScript, RESTful se…",IT Jobs
Software Engineer,Bamboo Rose,UK,"About Bamboo Rose At Bamboo Rose, we’re building the world’s leading collaborative product development platform for global retail. Our technology helps retailers and brands bring great products to market faster, smarter, and more sustainably. We’re a team that values curiosity, craftsmanship, and collaboration- and we’re looking for people who love to solve complex, real-world problems and make an impact across global supply chains. About the Role Bamboo Rose is expanding the engineering team f…",IT Jobs
Software Engineer,YourPrime,"Manchester, Greater Manchester","Founding Engineer Manchester (Hybrid) AI Product / Mobile / SaaS The Opportunity We’re working with an early-stage, mission-led software business looking to hire a Founding Engineer to play a key role in the next evolution of their product. The business already has a live platform and strong market relevance — the next phase is about rebuilding and improving the product for the AI era , with a particular focus on user experience, intelligent workflows, and mobile-first product thinking . This i…",IT Jobs
Software Engineer,Bamboo Rose,UK,"About Bamboo Rose At Bamboo Rose, we’re building the world’s leading collaborative product development platform for global retail. Our technology helps retailers and brands bring great products to market faster, smarter, and more sustainably. We’re a team that values curiosity, craftsmanship, and collaboration- and we’re looking for people who love to solve complex, real-world problems and make an impact across global supply chains. About the Role Bamboo Rose is expanding the engineering team f…",IT Jobs
Software Engineer,Finalto,"The City, Central London","About Finalto Finalto is a global leader in liquidity provision and trading technology solutions, serving institutional and B2B clients across financial markets worldwide. With regulated entities in the UK, Singapore, Cyprus, Australia, and the UAE, and additional operational teams in Denmark and Bulgaria, we combine international reach with local expertise. As part of a global financial services group, Finalto combines the scale and stability of an established organisation with the agility of …",IT Jobs
Software Engineer,Finalto,"London, UK","About Finalto Finalto is a global leader in liquidity provision and trading technology solutions, serving institutional and B2B clients across financial markets worldwide. With regulated entities in the UK, Singapore, Cyprus, Australia, and the UAE, and additional operational teams in Denmark and Bulgaria, we combine international reach with local expertise. As part of a global financial services group, Finalto combines the scale and stability of an established organisation with the agility of …",IT Jobs
Software Engineer,Qurated,"Manchester, Greater Manchester","We are supporting a leading Tier 1 Bank, who are going through a completely greenfield on-shoring transformation within the Custsomer Care engineering capabilities. They are going through an exciting journey to establish a next generational engineering centre with the best-in-class technologists and teams across the UK. This is an opportunity for someone who has a strong hands on background in Java, and a focus on AWS Environments. To design, develop and improve software, utilising various engi…",IT Jobs
Software Engineer,Bolt Technical,"Kent, South East England","Job Title Software Developer - Back end Location Kent Salary £40,000 - £45,000 per annum (depending on experience) Hours 08:00 – 16:00 (30-minute lunch) Flexible working available Hybrid working available after 6-month probation About the Opportunity Bolt Technical are recruiting on behalf of our client for a Back End Software Developer to join their growing engineering team. This is an excellent opportunity to work within a business that designs and manufactures advanced camera systems used ac…",IT Jobs
Software Engineer,Acceler8 Talent,UK," Hiring: Forward Deployed Engineer (Fully Remote across the UK) I’m partnering with a leading Revenue Ops platform transforming the commercial insurance space with a cutting-edge AI system that pulls from hundreds of data sources to modernize underwriting.  $180M funded (Series A–D)  7-figure recurring revenue  Fully remote  World-class engineering team This is a high-impact, customer-facing engineering role where you’ll architect and build custom solutions directly with enterprise clients. You…",IT Jobs
Software Engineer,Matchtech,"Bristol, South West England","Software Developer – Critical Defence Systems Bristol Based - 4 days a week on site Are you a C++ developer who thrives on solving complex technical challenges? Do you want to work on software that truly matters —systems that sit at the heart of critical defence capability? If so, this is a rare opportunity to join an innovative engineering team working at the cutting edge of systems‑level development. The Opportunity You’ll contribute across the full software development lifecycle, developing …",IT Jobs
Software Engineer,LTM,"London, UK","About the Company The mission of LTM Company is to engineer meaningful technology solutions to help businesses and societies flourish. Our successful technology business serves over 2000 Global customers and now, we are in a process of expanding. LTM is extending its technology business with specific expansion plans in UK Role: Shopify Engineer Location: London, UK (2 days onsite) About the Role Seeking a Middleware Backend Engineer with hands-on experience in Shopify Hydrogen framework and exp…",IT Jobs
Software Engineer,Quantus Labs,"London, UK","We're building Folio AI — the next generation commerce engine for millions of businesses. This is a core engineering role. Your first mission: own our mobile apps. But this isn't a siloed mobile role — you'll work across the stack, from mobile clients to backend systems and APIs, wherever the hardest problems are. We're a small team, so boundaries between roles are thin. What matters is that you can go deep on hard technical problems and ship production systems that work. You'll: → Own and evol…",IT Jobs
Software Engineer,LTM,"The City, Central London","About the Company The mission of LTM Company is to engineer meaningful technology solutions to help businesses and societies flourish. Our successful technology business serves over 2000 Global customers and now, we are in a process of expanding. LTM is extending its technology business with specific expansion plans in UK Role: Shopify Engineer Location: London, UK (2 days onsite) About the Role Seeking a Middleware Backend Engineer with hands-on experience in Shopify Hydrogen framework and exp…",IT Jobs
"Staff Software Engineer (Java, Glasgow)",LMA Recruitment,"Glasgow City Centre, Glasgow",Staff Software Engineer | Enterprise Technology Hub Location: Glasgow (Hybrid - City Centre) Role Type: Contract-to-Permanent Daily Rate: Up to £550 per day (Inside IR35 / PAYE) Sector: Global Tier 1 Institutional Technology The Opportunity We are seeking a high-caliber Staff Software Engineer to spearhead critical modernization initiatives within a global technology hub. This role is designed for a technical visionary capable of navigating large-scale enterprise environments while leading the …,IT Jobs
Senior Software Engineer - eDV Cleared,Searchability NS&D,"London, UK","SENIOR SOFTWARE ENGINEER - eDV CLEARED NEW PERMANENT JOB OPPORTUNITY AVAILABLE WITHIN A GLOBALLY LEADING NATIONAL SECURITY COMPANY FOR A SENIOR SOFTWARE ENGINEER WITH eDV CLEARANCE Permanent job opportunity for a Senior Software Engineer Globally leading defence / cyber security company Salary up to £100,000 plus clearance bonus London based organisation in an easily accessible location Permanent Software Engineer To apply please call / or email WHO WE ARE? We are recruiting Senior and Lead Sof…",IT Jobs
Cyber Software Engineer - Security Cleared,Searchability NS&D,"Manchester, Greater Manchester","Cyber Software Engineer - SC / DV / eDV Cleared New Permanent Opportunity for Cyber Software Engineers in Manchester with Security Clearance to work on Mission-Critical, National Security projects Role: Cyber Software Engineer Location: Manchester (hybrid) Clearance: SC, MOD DV or eDV (must be held or eligible) To apply : Email:",IT Jobs
Contract Software Engineer - eDV Cleared,Searchability NS&D,"London, UK","Contract Software Engineer - Enhanced DV Cleared New Contract Opportunity for a Software Engineer with Data experience in London with eDV Clearance New contract opportunity to work on operational projects across the National Security domain Enhanced DV Clearance required for high-side IT access London based (on site, minimum 4 days per week) Daily rate up to £800 DOE To apply, get in touch: dominic.",IT Jobs
Backend Software Engineer - eDV Cleared,Searchability NS&D,"Manchester, Greater Manchester","Software Engineer - eDV Cleared New Opportunity in Manchester for Backend Developers who want to work on mission-critical, operational projects Can be based in Manchester, Bury, Harrogate Up to £75,000  Benefits Clearance bonus  company bonus To apply, email:",IT Jobs
Backend Software Engineer - eDV Cleared,Searchability NS&D,"Cheltenham, Gloucestershire","Software Engineer - eDV Cleared New Opportunity in Cheltenham for Backend Developers who want to work on mission-critical, operational projects Can be based in Cheltenham, Bristol, Gloucester Up to £75,000  Benefits Clearance bonus  company bonus To apply, email:",IT Jobs
AI Software Engineer - Security Cleared,Searchability NS&D,"Leeds, West Yorkshire","AI Software Engineer - SC / DV Cleared Location: UK (Fully Remote, occasional client site visits) Salary: £45,000 - £80,000 DOE  Company Bonus Employment: Permanent Security Clearance: SC or MOD DV required To apply, email :",IT Jobs
AI Software Engineer - Security Cleared,Searchability NS&D,"Sheffield, South Yorkshire","AI Software Engineer - SC / DV Cleared Location: UK (Fully Remote, occasional client site visits) Salary: £45,000 - £80,000 DOE  Company Bonus Employment: Permanent Security Clearance: SC or MOD DV required To apply, email :",IT Jobs
Software Engineer (Cloud & Data Migration),Randstad Technologies,"Manchester, Greater Manchester","Software Engineer (Cloud & Data Migration) The Opportunity Join a global leader in the digital product space, building high-concurrency systems for millions of users. We are looking for a Senior Engineer to drive our back-end strategy and cloud deployment using a modern, best-in-class stack. Key Requirements Java Mastery: 5 years of experience (Java 17 preferred) with a focus on performance tuning. Spring Ecosystem: Deep expertise in Spring Boot, Data, and Security. Cloud & DevOps: Strong AWS k…",IT Jobs
DSP Embedded Software Engineer - Software Defined Radio Datalink,Morson Edge,"Stevenage, Hertfordshire","DSP Embedded Software Engineer – Software Defined Radio Datalink Stevenage (onsite role) – 6 month duration – Pay rate up to £53.51 p/h PAYE basic (£61.29 p/h including holiday pay) or £70 p/h Umbrella We are looking to recruit an Embedded Software Engineer to join our defence client in this onsite role based in Stevenage. You will be joining the growing Software team working to develop, test and deliver innovative solutions by exploiting a wide portfolio of software technologies. You will work…",Engineering Jobs
Backend Software Engineer Python Data R&D,Client Server,"Chesterton, Cambridge","Backend Software Engineer / Developer (Python Data R&D) Cambridge onsite to £55k Would you like to work on Greenfield projects at the cutting edge of medical technology? You could be joining a well funded start-up, collaborating with scientists and other engineers to develop sensing and imaging terahertz solutions. As a Backend Software Engineer you'll work on complex problems including image processing, machine learning, numerical simulation, user interfaces, databases, networking and interfac…",IT Jobs
Senior Software Engineer (£60k  benefits),Morson Edge,"Manchester Science Park, Manchester","Great opportunity for a Senior Software Engineer to join a SaaS company in Wigan as they go through a period of growth. You'd join a small cross-functional team in a fast-paced environment where you'd be given the opportunity to own all aspects of the systems you work on, from design through to deployment and supporting them in production. As a Senior Software Engineer you'd play a key role in system design, helping to modernise their existing microservices and improve observability and testabi…",IT Jobs
Java Full Stack Software Engineer,Sanderson Government and Defence,"Normanton, West Yorkshire","Full Stack Software Engineer Join a trusted supplier delivering mission-critical solutions in the defence and national security sector. You will work on leading-edge technologies across AI/Data Science, Cyber, Cloud, DevOps/SRE, and Platform Engineering, developing solutions that protect people, platforms, and information against constantly evolving threats. The Role As a Full Stack Software Engineer, you will design, develop, and maintain mission-critical softwares. You will work on novel prod…",IT Jobs
Software Engineer (Embedded / R&D),Career Poster,"Farnborough, Hampshire","About Voltitude Voltitude (founded 2020) is a specialist engineering company based in Farnborough, UK. Our team brings decades of experience across aviation, space, and defence, with world leading expertise in High-Altitude Pseudo-Satellites (HAPS), both fixed wing and lighter than air. We develop advanced technologies, payload systems and engineering solutions that help unlock and operationalise the stratosphere. If you want to work at the leading edge of novel flight systems in a company wher…",IT Jobs
Cyber Software Engineer - National Security,Sanderson Government and Defence,"South East London, London","The successful applicant will join teams working at the forefront of AI/DS, Cyber, Cloud, DevOps/SRE and Platform Engineering. With long-term programmes secured across the latest frameworks, this position offers the chance to be part of an exciting growth journey with significant technical depth and variety. As a Cyber Software Engineer, you will contribute to the research, design and development of critical systems in support of National Security missions. You will apply secure coding practice…",IT Jobs
Lead Embedded Software Engineer - C / C++,Redline Group Ltd,"Willingdon, Eastbourne","An exciting opportunity has arisen for a Lead Embedded Software Engineer based in East Sussex to join this global leader in cutting edge electronic instrumentation. Joining their multidisciplined R&D team at their global centre of excellence, as a Lead Embedded Software Engineer you will develop and support software for significant projects aligned to business critical needs. You will be involved in all stages of the software development lifecycle from requirements capturing to release validati…",IT Jobs
Senior Embedded Software Engineer - C/C++,Redline Group Ltd,"Willingdon, Eastbourne","An exciting opportunity has arisen for a Senior Embedded Software Engineer based in East Sussex to join this global leader in cutting edge electronic instrumentation. Joining their multidisciplined R&D team at their global centre of excellence, as a Senior Embedded Software Engineer you will develop and support software for significant projects aligned to business critical needs. You will be involved in all stages of the software development lifecycle from requirements capturing to release vali…",IT Jobs
Software Engineer (2-3 years .NET),Ocho,"Belfast, Northern Ireland","Are you a .NET Software Engineer looking to build robust, high-quality systems within fintech and continue developing your technical skill set? My client is a fintech organisation developing scalable, business-critical platforms used in a fast-paced environment. They are seeking a .NET Software Engineer with around 3-4 years of commercial experience who enjoys writing clean code, working on meaningful problems, and contributing to well-designed systems. The Role In this role, you will: Develop …",IT Jobs
Senior Software Engineer,True North Group,"Manchester, Greater Manchester","Role Title: Senior Software Engineer Day Rate: Up to £425 per day inside IR35 Clearance Required: SC Eligible Contract Length: Initial 3 months Start Date: ASAP Manchester-based role Hybrid working with 1 day per week on-site An experienced Senior Software Engineer is required to support the delivery of a central government compensation service. This role is primarily backend-focused, with some frontend responsibilities, and requires strong Java expertise within a modern microservices architect…",IT Jobs
Senior Software Engineer,Harnham - Data & Analytics Recruitment,"London, UK","SENIOR SOFTWARE ENGINEER £85,000 LONDON We're working with a well-established digital media and technology organisation who are growing their engineering function and hiring Senior Software Engineers to help shape the next phase of their internal platforms. This role suits engineers who enjoy thinking beyond tickets, people who ask why , challenge assumptions, and care about designing systems properly rather than just shipping code. THE COMPANY A large-scale media and advertising business opera…",IT Jobs
Software Development Engineer,FBI &TMT,"Malvern, Worcestershire","Our client, a leader in the Technology, Defence & Security sector, is seeking a passionate and skilled Software Development Engineer to join their team in Malvern. This permanent role offers the opportunity to work with cutting-edge technology and collaborate with some of the brightest minds in the industry. Key Responsibilities: Supporting the gathering and translation of software requirements Designing, implementing and maintaining software solutions Developing new modules, fixing bugs and so…",IT Jobs
Software Architect Engineer,Futura Design Limited,"West Midlands, UK","Our OEM Client based in Gaydon, is searching for a Software Architect Engineer to join their team, Inside IR35. This is a contract position with a proposed end date of 31st March 2027. Umbrella Pay Rate: £27.03 per hour. Duties: Software Architecture Engineering (High Tech) focuses on architecting multiple types/categories of software including end-user applications and operating systems/utility software (which provides a platform for running end user applications) for sale to external customer…",IT Jobs
Software Engineer - Quant - Barings,Barings,"London, UK","At Barings, we are as invested in our associates as we are in our clients. We recognize those who work diligently for us and reward them for personal and professional integrity, communication skills, distinct competencies and expertise in specific strategies, ability to collaborate as a team member and true dedication to the interests of our clients. We thank you for your interest in joining the Barings team, and invite you to explore our current employment opportunities. Software Engineer - Qu…",IT Jobs
Contract Senior Software Engineer - eDV Cleared,Searchability NS&D,"London, UK",CONTRACT SENIOR SOFTWARE ENGINEER - eDV CLEARED NEW CONTRACT JOB OPPORTUNITY AVAILABLE WITHIN A LEADING NATIONAL SECURITY COMPANY FOR A SENIOR SOFTWARE ENGINEER WITH eDV CLEARANCE Contract job opportunity for a Senior Software Engineer Globally leading defence / cyber security company £500 - £750 per day (inside and outside IR35 roles available) London based organisation in an easily accessible location Contract Senior Software Engineer To apply please call or email,IT Jobs
Senior Software Engineer,Formula.,UK,"Contract role : Senior Software Engineer : Up to £475 per day Outside IR35 : 3 months rolling : Hybrid Monthly (London) An innovative digital consultancy is looking for experienced Senior Software Engineers to design and architect scalable, high-performance systems for a cutting-edge platform being developed for a major client. In this role, you’ll tackle complex technical challenges as part of an agile team following Scrum methodologies. As a Senior Software Engineer, you’ll set the standard f…",IT Jobs
C++ Software Engineer,IC Resources,"Cambridge, Cambridgeshire","The right to work in the UK without sponsorship is essential for this vacancy. An exciting opportunity for a Senior C++ Software Engineer has arisen at a technology firm delivering low-latency trading solutions, based in Cambridge. This is a great opportunity for a Senior C++ Software Engineer to design and develop C++ software on Linux OS, contributing to next-generation trading systems that combine custom silicon with advanced software engineering. You will commit to a hybrid working model, r…",IT Jobs
Java Software Engineer,IC Resources,"The City, Central London","An exciting opportunity for a Java Software Engineer has arisen with a leading semiconductor company specialising in high-performance mixed-signal processing, based in London. This is an exciting opportunity for a Java Software Engineer to design and evolve cross-platform applications, SDKs, and developer tooling. You’ll work closely with UX specialists, hardware teams, and software engineers to build polished internal tools that power advanced hardware configuration and tuning workflows. You w…",IT Jobs
Java Software Engineer,IC Resources,"London, UK","An exciting opportunity for a Java Software Engineer has arisen with a leading semiconductor company specialising in high-performance mixed-signal processing, based in London. This is an exciting opportunity for a Java Software Engineer to design and evolve cross-platform applications, SDKs, and developer tooling. You’ll work closely with UX specialists, hardware teams, and software engineers to build polished internal tools that power advanced hardware configuration and tuning workflows. You w…",IT Jobs
C++ Software Engineer,IC Resources,"Cambridge, Cambridgeshire","An exciting opportunity for a C++ Software Engineer has arisen at a fast-growing quantum computing company, based in Cambridge. This is a great opportunity for a C++ Software Engineer to design and build software models and simulations of next-generation quantum computing systems. You will commit to a hybrid working model, required onsite 2 days a week. Experience of the C++ Software Engineer includes: Programming skills with C++ and/or Rust Strong mathematical or physics background Understandi…",IT Jobs
